{
  "version": "1.0.0",
  "projectName": "Woofskis",
  "lastUpdated": "2026-10-22",
  "nodes": [
    {
      "id": "domain:auth",
      "type": "Domain",
      "label": "Authentication & RBAC Domain",
      "domain": "Authentication",
      "description": "User identity, registration, JWT session issuance, and role-based access control.",
      "status": "IMPLEMENTED",
      "sourceReference": {
        "chapter": "Chapter 11",
        "section": "11.2",
        "docPath": "/docs/source/11 Key Features & Capabilities 394ca8c5bdf78082b980efceda5d1744.md"
      },
      "codeReference": {
        "repository": "backend",
        "filePath": "src/controllers/auth.controller.ts",
        "symbol": "AuthController"
      }
    },
    {
      "id": "domain:judging",
      "type": "Domain",
      "label": "Continuous Judging & Voting Domain",
      "domain": "Judging",
      "description": "One-video-at-a-time evaluation loop, numeric scoring (1-5), and consensus calculation.",
      "status": "IMPLEMENTED",
      "sourceReference": {
        "chapter": "Chapter 4",
        "section": "4.2",
        "docPath": "/docs/source/4 Proposed Solution 390ca8c5bdf780a0b489efeb96dafd91.md"
      },
      "codeReference": {
        "repository": "frontend",
        "filePath": "src/features/judging/hooks/use-contest-queue.ts",
        "symbol": "useContestQueue"
      }
    },
    {
      "id": "domain:submissions",
      "type": "Domain",
      "label": "Creator Submissions Domain",
      "domain": "Submissions",
      "description": "Creator video uploading, validation, and submission status lifecycle tracking.",
      "status": "IMPLEMENTED",
      "sourceReference": {
        "chapter": "Chapter 11",
        "section": "11.4",
        "docPath": "/docs/source/11 Key Features & Capabilities 394ca8c5bdf78082b980efceda5d1744.md"
      },
      "codeReference": {
        "repository": "frontend",
        "filePath": "src/features/submissions/components/upload-modal.tsx",
        "symbol": "UploadModal"
      }
    },
    {
      "id": "domain:contests",
      "type": "Domain",
      "label": "Contest Management Domain",
      "domain": "Contests",
      "description": "Contest lifecycle scheduling, categories, prize pools, and state transitions.",
      "status": "IMPLEMENTED",
      "sourceReference": {
        "chapter": "Chapter 11",
        "section": "11.3",
        "docPath": "/docs/source/11 Key Features & Capabilities 394ca8c5bdf78082b980efceda5d1744.md"
      },
      "codeReference": {
        "repository": "frontend",
        "filePath": "src/features/admin/components/contest-create-modal.tsx",
        "symbol": "ContestCreateModal"
      }
    },
    {
      "id": "domain:moderation",
      "type": "Domain",
      "label": "Content Moderation & Auditing Domain",
      "domain": "Moderation",
      "description": "Split-viewer video inspection, rejection feedback, and append-only audit logging.",
      "status": "IMPLEMENTED",
      "sourceReference": {
        "chapter": "Chapter 10",
        "section": "10.6",
        "docPath": "/docs/source/10 User Journey & Business Process 394ca8c5bdf78027b716ec91531bf108.md"
      },
      "codeReference": {
        "repository": "frontend",
        "filePath": "src/features/admin/components/moderation-split-viewer.tsx",
        "symbol": "ModerationSplitViewer"
      }
    },
    {
      "id": "domain:leaderboard",
      "type": "Domain",
      "label": "Dynamic Leaderboard Domain",
      "domain": "Leaderboard",
      "description": "Community score aggregation, podium top 3 ranking, and category filtering.",
      "status": "IMPLEMENTED",
      "sourceReference": {
        "chapter": "Chapter 11",
        "section": "11.5",
        "docPath": "/docs/source/11 Key Features & Capabilities 394ca8c5bdf78082b980efceda5d1744.md"
      },
      "codeReference": {
        "repository": "frontend",
        "filePath": "src/features/leaderboard/components/leaderboard-podium.tsx",
        "symbol": "LeaderboardPodium"
      }
    },
    {
      "id": "domain:multitenancy",
      "type": "Domain",
      "label": "Multi-Tenancy & Brand Customization Domain",
      "domain": "MultiTenancy",
      "description": "Brand tenant provisioning, theme customizer, and organization data isolation.",
      "status": "IMPLEMENTED",
      "sourceReference": {
        "chapter": "Chapter 11",
        "section": "11.8",
        "docPath": "/docs/source/11 Key Features & Capabilities 394ca8c5bdf78082b980efceda5d1744.md"
      },
      "codeReference": {
        "repository": "frontend",
        "filePath": "src/features/admin/components/brand-theme-form.tsx",
        "symbol": "BrandThemeForm"
      }
    },
    {
      "id": "role:viewer",
      "type": "UserRole",
      "label": "Visitor / Voter Persona",
      "domain": "Authentication",
      "description": "Public community member evaluating competing video entries.",
      "status": "IMPLEMENTED",
      "sourceReference": {
        "chapter": "Chapter 8",
        "section": "8.2.2",
        "docPath": "/docs/source/8 Target Audience 390ca8c5bdf7808d9a64f679d23d5075.md"
      },
      "codeReference": {
        "repository": "backend",
        "filePath": "prisma/schema.prisma",
        "symbol": "Role.VIEWER"
      }
    },
    {
      "id": "role:creator",
      "type": "UserRole",
      "label": "Content Creator Persona",
      "domain": "Authentication",
      "description": "Authenticated user uploading video entries to compete in contests.",
      "status": "IMPLEMENTED",
      "sourceReference": {
        "chapter": "Chapter 8",
        "section": "8.2.1",
        "docPath": "/docs/source/8 Target Audience 390ca8c5bdf7808d9a64f679d23d5075.md"
      },
      "codeReference": {
        "repository": "backend",
        "filePath": "prisma/schema.prisma",
        "symbol": "Role.CREATOR"
      }
    },
    {
      "id": "role:brand_admin",
      "type": "UserRole",
      "label": "Brand Administrator Persona",
      "domain": "Authentication",
      "description": "Organization manager configuring branded contests and moderating submissions.",
      "status": "IMPLEMENTED",
      "sourceReference": {
        "chapter": "Chapter 8",
        "section": "8.3.2",
        "docPath": "/docs/source/8 Target Audience 390ca8c5bdf7808d9a64f679d23d5075.md"
      },
      "codeReference": {
        "repository": "backend",
        "filePath": "prisma/schema.prisma",
        "symbol": "Role.BRAND_ADMIN"
      }
    },
    {
      "id": "role:super_admin",
      "type": "UserRole",
      "label": "Platform Super Administrator Persona",
      "domain": "Authentication",
      "description": "Global platform operator managing tenant provisioning and cross-brand governance.",
      "status": "IMPLEMENTED",
      "sourceReference": {
        "chapter": "Chapter 8",
        "section": "8.3.3",
        "docPath": "/docs/source/8 Target Audience 390ca8c5bdf7808d9a64f679d23d5075.md"
      },
      "codeReference": {
        "repository": "backend",
        "filePath": "prisma/schema.prisma",
        "symbol": "Role.SUPER_ADMIN"
      }
    },
    {
      "id": "perm:rate_video",
      "type": "Permission",
      "label": "Rate Contest Video",
      "domain": "Judging",
      "description": "Permission to cast a 1-5 numerical score on candidate contest submissions.",
      "status": "IMPLEMENTED",
      "sourceReference": {
        "chapter": "Chapter 12",
        "section": "12.5",
        "docPath": "/docs/source/12 Business Rules 394ca8c5bdf78008b70ed22f71231996.md"
      }
    },
    {
      "id": "perm:upload_video",
      "type": "Permission",
      "label": "Upload Contest Video",
      "domain": "Submissions",
      "description": "Permission to submit original video entries into active contests.",
      "status": "IMPLEMENTED",
      "sourceReference": {
        "chapter": "Chapter 12",
        "section": "12.4",
        "docPath": "/docs/source/12 Business Rules 394ca8c5bdf78008b70ed22f71231996.md"
      }
    },
    {
      "id": "perm:moderate_submission",
      "type": "Permission",
      "label": "Moderate Submissions",
      "domain": "Moderation",
      "description": "Permission to approve or reject pending video submissions.",
      "status": "IMPLEMENTED",
      "sourceReference": {
        "chapter": "Chapter 12",
        "section": "12.4",
        "docPath": "/docs/source/12 Business Rules 394ca8c5bdf78008b70ed22f71231996.md"
      }
    },
    {
      "id": "perm:create_contest",
      "type": "Permission",
      "label": "Create & Manage Contests",
      "domain": "Contests",
      "description": "Permission to create contest instances, configure schedules, and define prize pools.",
      "status": "IMPLEMENTED",
      "sourceReference": {
        "chapter": "Chapter 12",
        "section": "12.6",
        "docPath": "/docs/source/12 Business Rules 394ca8c5bdf78008b70ed22f71231996.md"
      }
    },
    {
      "id": "perm:manage_tenants",
      "type": "Permission",
      "label": "Manage Platform Tenants",
      "domain": "MultiTenancy",
      "description": "Permission to provision, configure, or suspend brand organizations.",
      "status": "IMPLEMENTED",
      "sourceReference": {
        "chapter": "Chapter 11",
        "section": "11.8",
        "docPath": "/docs/source/11 Key Features & Capabilities 394ca8c5bdf78082b980efceda5d1744.md"
      }
    },
    {
      "id": "feat:continuous_queue",
      "type": "Feature",
      "label": "Continuous Video Judging Queue",
      "domain": "Judging",
      "description": "Focused single-video vertical player queue with auto-advance and keyboard navigation. Loads approved entries from the judging queue API.",
      "status": "IMPLEMENTED",
      "sourceReference": {
        "chapter": "Chapter 6",
        "section": "6.2",
        "docPath": "/docs/source/6 Product Vision 390ca8c5bdf780e9810ac7d28a2ae7fd.md"
      },
      "codeReference": {
        "repository": "frontend",